{
  "apiVersion": 1,
  "id": "my-plugin",
  "name": "My plugin",
  "version": "0.1.0",
  "description": "A rail icon, a sidebar panel and a tab.",
  "icon": "icon.svg",
  "rail": { "title": "My plugin", "panel": "main" },
  "panels": {
    "main": {
      "title": "My plugin",
      "entry": "pages/panel.html",
      "actions": [{ "id": "open", "title": "Open a tab", "icon": "plus" }]
    }
  },
  "tabs": {
    "page": { "title": "Page", "entry": "pages/tab.html" }
  },
  "commands": [{ "id": "open", "title": "Open a tab", "tab": "page" }]
}
